[
  {
    "user_input": "What clause governs contractor claims in GCC?",
    "retrieved_contexts": [
      "ur \nshall, for the purpose of this Clause, still be deemed to be persons employed by the Contractor. GCC April 2022 \n \n \n \n87 \n \n \nIf any moneys shall, as a result of any claim or application made under the said Act be \ndirected to be paid by the Railway, such money shall be deemed to be moneys payable to the Railway \nby the Contractor and on failure by the Contractor to repay the Railway any moneys paid by it as \naforesaid within seven days after the same shall have been demanded, the Railways shall be entitled \nto recover the same from Contractor\u2019s bills/Security Deposit or any other dues of Contractor with the \nGovernment of India. 54-A.\nSub-Clause (2) above shall be paid for at the rates \ndetermined under Clause-39 of these Conditions. CLAIMS \n43.(1)  Quarterly Statement of Claims: The Contractor shall prepare and furnish to the Engineer \nonce in every quarter commencing from the month following the month of issue of Letter of \nAcceptance, an account giving full and detailed particulars of all claims for any additional expenses \nto which the Contractor may consider himself entitled to and of all extra or additional works ordered \nby the Engineer which he has executed during the preceding quarter and no claim for payment for \nsuch work will be considered which has not been included in such particulars.\nSub-Clause (2) \nabove shall be paid for at the rates determined under Clause-39 of these Conditions. CLAIMS \n43.(1)  Quarterly Statement of Claims: The Contractor shall prepare and furnish to the \nEngineer once in every quarter commencing from the month following the month of issue of \nLetter of Acceptance, an account giving full and detailed particulars of all claims for any \nadditional expenses to which the Contractor may consider himself entitled to and of all extra or \nadditional works ordered by the Engineer which he has executed during the preceding month \nquarter and no claim for payment for such work will be considered which has not been \nincluded in such particulars."
    ],
    "response": "Clause 43 governs contractor claims in GCC. Additionally, Sub-Clause (2) is paid for at the rates determined under Clause-39 of these Conditions.",
    "reference": "Clause 20.1 governs contractor claims.",
    "faithfulness": 1.0,
    "answer_relevancy": 0.7078869816074839,
    "context_precision": 0.0,
    "context_recall": 0.0
  }
]